volume,title,keywords,journal,authors,institutes,abstract
"2013, (15)",基础胰岛素联合二肽基肽酶4抑制剂治疗2型糖尿病患者临床观察,"2型糖尿病,西格列汀,基础胰岛素",中国医学创新,"王达莉,曾晓,任碧池,罗颖","武汉大学基础医学院湖北武汉434000,湖北省荆州市第三人民医院","目的:探讨基础胰岛素(甘精胰岛素,商品名来的适,赛诺菲安万特公司生产)联合二肽基肽酶4抑制剂(磷酸西格列汀,商品名捷诺维,默沙东公司生产)治疗单用基胰岛素血糖控制不佳的2型糖尿病患者的临床疗效.方法:将120例单用基础胰岛素、体重指数(BMI)≥26、血糖控制不理想的2型糖尿病患者随机分成两组:(甘精胰岛素+西格列汀)组60例,在使用甘精胰岛素的基础上应用西格列汀100mg/d口服,根据血糖水平适时调整基础胰岛素用量;基础胰岛素组60例,继续应用甘精胰岛素治疗.观察治疗前、治疗后8周、12周两组患者的体重指数(BMI)、空腹血糖(FBG)、餐后2h血糖(2hPG)、糖化血红蛋白(HbA1c)、胰岛素用量的改变.结果:治疗后8、12周时,两组血糖、HbA1C均有下降;8周时,基础胰岛素组BMI增加,基础胰岛素+西格列汀组体重增加不明显,两组间同期比较差异有统计学意义,组内治疗前后胰岛素组比较差异有统计学意义(P"
"2012, (10)",2型糖尿病新型口服复方片剂获批,,糖尿病天地·文摘（中旬）,,,"默沙东9月10日宣布,其治疗2型糖尿病的新型口服片剂捷诺达已经得到国家食品药品监督管理局的批准上市.据了解,捷诺达是首个口服降糖治疗药物二肽基肽酶4(DPP-4)抑制剂捷诺维家族的复合物,含有两种可以提供持久有效控制血糖的药物成分——西格列汀和二甲双胍."
,中国非肥胖人群糖尿病患病特点分析及吡考啉酸铬治疗中国新诊断2型糖尿病患者的疗效研究,,,邵聪,,
"2012, 92(22)",天麦消渴片治疗中国新诊断2型糖尿病患者的疗效研究,"糖尿病,2型,天麦消渴片,吡考啉酸铬",中华医学杂志,"邵聪,吕肖峰,肖新华,许樟荣,杨兆军,王芃,刘雪莉,杨文英","100730,中国医学科学院北京协和医学院研究生院,北京军区总医院内分泌科,中国医学科学院北京协和医学院北京协和医院内分泌科,解放军第三○六医院内分泌科,中日友好医院内分泌科","目的分析天麦消渴片治疗新诊断2型糖尿病患者的疗效及影响因素.方法纳入符合条件的2型糖尿病患者84例,采用区组随机化分为2组:试验组42例,口服天麦消渴片240mg/次,每日2次；对照组42例,口服西格列汀(捷诺维)100mg/d.治疗24周后以糖化血红蛋白(HbA1c)、空腹血糖(FPG)及餐后2h血糖(PG2h)、血清铬水平等评价服用天麦消渴片的有效性,同时通过测定胰岛素抵抗和β细胞功能的指标,探讨补铬改善血糖的作用机制.应用多因素线性回归分析各因素与HbA1c变化之间的关系.结果入组84例,76例完成了试验.治疗前糖尿病组血清铬水平显著低于正常对照组[(56±28)μg/L比(112±21)μg/L,P=0.00].治疗24周后,两组HbA1c,FPG和PG2h较前均显著降低,血清铬水平显著增加.天麦消渴片组治疗后HbA1c下降≥1％者11例(占28.2％),基线血清铬水平较低,用药24周后升高[(36.2±18.0)μg/L比(71.4±36.1)μg/L,P=0.01],同时HbA1c降低(8.38％±0.72％比6.77％±0.62％),降幅达1.61％.两组按基线血清铬水平分3个亚组,分别为＜40μg/L,40～65μg/L和＞65μg/L.当血清铬＜40μg/L时,天麦消渴片组HbA1c显著降低,下降幅度为1.09％；当血清铬＞65μg/L时,HbA1c无显著变化.西格列汀组HbA1c变化值(△HbA1c)与基线血清铬水平无关.治疗24周后,两组胰岛素抵抗指数(HOMA-IR)均有所降低,β细胞功能指数(HOMA-β)和早相分泌指数(IGI)有所增加.各指数组间比较差异无统计学意义.多因素线性回归分析显示基线血铬、基线HbA1c与△HbA1c显著相关.结论新诊断2型糖尿病患者体内普遍缺铬.补铬可使糖尿病患者HbA1c改善,当糖尿病患者血清铬低于40μg/L时,给予天麦消渴片补充铬至正常或略低于正常水平可使HbA1c显著降低."
,西格列汀联合二甲双胍对2型糖尿病患者疗效,,,苗秀美,,
"2012, 09(16)",磷酸西格列汀片药学专家顾问咨询会在京举行,,药品评价,王璟,,"2012年5月17日,默沙东制药有限公司在北京王府井希尔顿酒店召开其产品捷诺维(磷酸西格列汀片)药学专家顾问咨询会.会议邀请了301医院内分泌科主任、中华内分泌学分会副主任委员母义明教授;中华医学会临床药物评价专家委员会副主任委员兼秘书长王汝龙教授;中国药学会副理事长、常务理事、中国药学会医院药学专业委员会主任委员李大魁教授;北京大学人民医院药剂科主任、中国药学会药事管理专业委员会副主任委员李玉珍教授.与会的专家还有20多位各大医院的药剂科主任."
"2010, (10)",一种全新的口服降糖药——捷诺维[西格列汀],,糖尿病新世界,"倪婷婷,邹大进",长海医院内分泌科,"中国是糖尿病大国,中华医学会糖尿病学分会公布的统计显示,中国已有糖尿病患者4000万,95%左右的糖尿病患者属于2型糖尿病.大部分2型糖尿病患者日常主要的治疗工作是控制血糖,然而,即使通过现有多种口服药物治疗和控制,目前中国仍有超过70%的患者无法达到理想的血糖控制.因此除了患者对糖尿病知识的学习以及自我的管理有待加强,药物治疗的选择也至关重要.对于药物,我们希望能够安全、有效的降糖,又不会产生太多其他的副作用."
"2013, (10)",西格列汀（捷诺维）联合二甲双胍治疗2型糖尿病87例疗效观察,"西格列汀,二甲双胍,2型糖尿病",现代诊断与治疗,沈万民,"清远市广清医院内科,广东清远,511515",　　选择2011年6月1日～2013年2月1日于我院治疗的87例2型糖尿病患者，按治疗方法分成两组，治疗组44例给予二甲双胍0.5/次，tid，于餐前服用，联合西格列汀0.1/次，qd。对照组43例仅给予二甲双胍治疗，0.5/次，tid，对比治疗前后两组餐后血糖、空腹血糖、糖化血红蛋白、体重指数变化情况。结果治疗前两组各项指标无显著差异（P>0.05），治疗后治疗组各项指标均优于对照组，差异具有统计学意义（P
